{
    "numberColumns":5,
    "numberRows":5,
    "initSkin": "Male",
    "timeTile": true,
    "enableLogo": 2,
    "disableNames": [
      "faceRecog",
      "cooper/Extra-low_voltage",
      "up2/ledg",
      "up2/ledr"
    ],
    "disableAtypes": [
      "Acceleration",
      "BinaryData",
      "Time",
      "Frequency",
      "Power",
      "PowerFactor",
      "Undef",
      "Consumption",
      "DateTime"
    ]
}
